{
    "ashok_report": {
        "applicationId": null,
        "documentId": null,
        "applicationType": "BUY TO LET MORTGAGE",
        "applicationNumber": "14301114853",
        "applicantName": "Mr Ashok Kumar",
        "dateOfInspection": "19/12/2025",
        "propertyAddress": "Hyderbad, flat 8 Detached House Semi-Detached HouseTerraced House xMaisonette xFlat Bungalow",
        "postCode": "LU7 1GN",
        "propertyType": {
            "isDetachedHouse": true,
            "isSemiDetachedHouse": true,
            "isTerracedHouse": true,
            "isBungalow": false,
            "isFlat": true,
            "isMaisonette": true,
            "flatMaisonetteFloor": 171,
            "numberOfFloorsInBlock": 17,
            "isBuiltOrOwnedByLocalAuthority": true,
            "ownerOccupationPercentage": 17,
            "isFlatMaisonetteConverted": true,
            "conversionYear": 2025,
            "isPurposeBuilt": true,
            "numberOfUnitsInBlock": 444,
            "isAboveCommercial": true,
            "residentialNatureImpact": "property e.g. ,",
            "tenure": "Freehold",
            "isFlyingFreehold": true,
            "flyingFreeholdPercentage": 17,
            "maintenanceCharge": null,
            "roadCharges": null,
            "groundRent": 1717.0,
            "remainingLeaseTermYears": 1717,
            "isPartCommercialUse": false,
            "commercialUsePercentage": 9,
            "isPurchasedUnderSharedOwnership": false,
            "yearBuilt": 2026
        },
        "accommodation": {
            "hall": 1,
            "livingRooms": 1,
            "kitchen": 1,
            "isLiftPresent": null,
            "utility": 1,
            "bedrooms": 1,
            "bathrooms": 1,
            "separateWc": 0,
            "basement": 0,
            "garage": 0,
            "parking": 0,
            "gardens": true,
            "isPrivate": true,
            "isCommunal": true,
            "numberOfOutbuildings": 171,
            "outbuildingDetails": null,
            "grossFloorAreaOfDwelling": 2025
        },
        "currentOccupency": {
            "isEverOccupied": false,
            "numberOfAdultsInProperty": 171,
            "isHmoOrMultiUnitFreeholdBlock": true,
            "isCurrentlyTenanted": false,
            "hmoOrMultiUnitDetails": null
        },
        "newBuild": {
            "isNewBuildOrRecentlyConverted": true,
            "isCompleted": true,
            "isUnderConstruction": true,
            "isFinalInspectionRequired": false,
            "isNhbcCert": true,
            "isBuildZone": null,
            "isPremier": true,
            "isProfessionalConsultant": true,
            "isOtherCert": null,
            "otherCertDetails": "please",
            "isSelfBuildProject": false,
            "isInvolvesPartExchange": true,
            "isDisclosureOfIncentivesSeen": true,
            "incentivesDetails": "if part exchange",
            "newBuildDeveloperName": "If property is New Build, please provide the name of"
        },
        "construction": {
            "isStandardConstruction": true,
            "nonStandardConstructionType": true,
            "mainWalls": "External finish",
            "mainRoof": "Unitised curtain walling facade",
            "garageConstruction": "Garage",
            "outbuildingsConstruction": "Outbuildings",
            "isHasAlterationsOrExtensions": true,
            "isAlterationsRequireConsents": false,
            "alterationsAge": null
        },
        "localityAndDemand": {
            "isUrban": true,
            "isSuburban": true,
            "isRural": true,
            "isGoodMarketAppeal": true,
            "isAverageMarketAppeal": true,
            "isPoorMarketAppeal": true,
            "isOwnerResidential": false,
            "isResidentialLet": true,
            "isCommercial": true,
            "isPricesRising": true,
            "isPricesStatic": true,
            "isPricesFalling": true,
            "isDemandRising": true,
            "isDemandStatic": true,
            "isDemandFalling": true,
            "isAffectedByCompulsoryPurchase": true,
            "compulsoryPurchaseDetails": null,
            "isVacantOrBoardedPropertiesNearby": true,
            "vacantOrBoardedDetails": null,
            "isOccupancyRestrictionPossible": true,
            "occupancyRestrictionDetails": null,
            "isCloseToHighVoltageEquipment": false,
            "highVoltageEquipmentDetails": null
        },
        "services": {
            "isMainsWater": true,
            "isPrivateWater": true,
            "isUnknownWater": true,
            "isGasSupply": false,
            "isElectricitySupply": true,
            "isCentralHeating": false,
            "centralHeatingType": null,
            "isMainDrainage": false,
            "isSepticTankPlant": true,
            "isUnknownDrainage": false,
            "isSolarPanels": true,
            "isSharedAccess": true,
            "isRoadAdopted": true,
            "isHasEasementsOrRightsOfWay": true,
            "easementsOrRightsDetails": null,
            "servicesSeparateForFlats": "",
            "servicesSeparateDetails": ""
        },
        "conditionsOfProperty": {
            "isStructuralMovement": false,
            "isStructuralMovementHistoricOrNonProgressive": null,
            "structuralMovementDetails": null,
            "isStructuralModifications": false,
            "structuralModificationsDetails": null,
            "communalAreasMaintained": null,
            "propertyProneTo": {
                "flooding": true,
                "subsidence": true,
                "heave": true,
                "landslip": true,
                "details": "please provide"
            },
            "isPlotBoundariesDefinedUnderPointFourHectares": false,
            "isTreesWithinInfluencingDistance": true,
            "treesInfluenceDetails": null,
            "isBuiltOnSteepSlope": null,
            "steepSlopeDetails": null
        },
        "reports": {
            "isTimberDamp": true,
            "isMining": true,
            "isElectrical": true,
            "isDrains": true,
            "isStructuralEngineers": null,
            "isArboricultural": true,
            "isMundic": true,
            "isWallTies": true,
            "isRoof": true,
            "isMetalliferous": true,
            "isSulfateRedAsh": null,
            "isOtherReport": null,
            "otherReportDetails": null
        },
        "energyEfficiency": {
            "epcRating": "Exempt",
            "epcScore": 91
        },
        "essentialRepairs": {
            "isEssentialRepairsRequired": null,
            "essentialRepairsDetails": null,
            "isReinspectionRequired": null
        },
        "rentalInformation": {
            "isRentalDemandInLocality": false,
            "rentalDemandDetails": null,
            "monthlyMarketRentPresentCondition": null,
            "monthlyMarketRentImprovedCondition": null,
            "isOtherLettingDemandFactors": null,
            "otherLettingDemandDetails": null,
            "investorOnlyDemand": null,
            "investorOnlyDemandDetails": null
        },
        "valuationForFinancePurpose": {
            "valuationComparativeOnly": null,
            "isSuitableForFinance": true,
            "financeSuitabilityDetails": "",
            "marketValuePresentCondition": 1717.0,
            "marketValueAfterRepairs": null,
            "purchasePriceOrBorrowerEstimate": 347018.0,
            "buildingInsuranceReinstatementCost": null,
            "isInsurancePremiumLoadingRisk": null,
            "insurancePremiumLoadingDetails": null
        },
        "valuationForFinancePurposeHPP": {
            "valuationComparativeOnly": null,
            "isSuitableForFinance": true,
            "financeSuitabilityDetails": "",
            "marketValuePresentCondition": 1717.0,
            "marketValueAfterRepairs": null,
            "purchasePriceOrBorrowerEstimate": 347018.0,
            "buildingInsuranceReinstatementCost": null,
            "isInsurancePremiumLoadingRisk": null,
            "insurancePremiumLoadingDetails": null
        },
        "generalRemarks": "The property is in an area of past mining activity. planningbreachThe valuation assumes that the houseboat pur poses There was no Ioft access This is a new build property without an EPc. Our valuation is provided on the assumption that the property will have an EPc of E or better upon completion Confirmation should be provided that the combustiblecladding system / bal conies fully complies with Building (Amendment) Regul ati ons Sl 2018/1230 prior to Iendi ng. If this is not the case the HS2 situation must be referred to the valuer as our val uation may be affected",
        "valuersDeclaration": {
            "valuerSignature": null,
            "valuerName": "Connells Survey & Val uati on Ltd",
            "onBehalfOf": "Connells Survey & Val uati on Ltd",
            "telephone": 1525218647,
            "fax": null,
            "email": "inc. STD code",
            "valuerQualifications": {
                "mrics": true,
                "frics": true,
                "assocRics": true
            },
            "ricsNumber": 888246,
            "valuerAddress": "Val uation Management Centre, Cumbria Hous E Bedf ord Connells Survey & Val uati on Ltd Lei ghton Buzzard LU7 1GN 01525218632",
            "valuerPostcode": "LU7 1GN",
            "reportDate": "19/ 121 2024"
        },
        "extractedText": "BUY TO LET MORTGAGE VALUATION REPORT gatehousebank Applicant(s) Surname(s) & Initials:. Application Number: 1430111-4853 Mr Ashok Kumar Date of Inspection: 19/12/2025 Property Address: Hyderbad, flat 8 PROPERTY TYPE ACCOMMODATION - State Number X Detached Housex Semi-Detached HouseXTerraced House 1 1 Yes Hall Living Rooms1 Kitchen xFlat xMaisonette x Utility 0 Bedrooms 2 Bathrooms 0Separate wc 0 Bungalow No. of floors in block17 If flat / maisonette on what floor?171 Basement 0 0Parking 0 Garage Property built or owned by the Local Authority? Yes XNo GardensNo Private If Yes x CommunalX If Yes, what is the approximate % of owner occupation 171 Number of outbuildings 0 Is flat / maisonette: (please provide details) If Converted, 2025 Test This Accommodation Converted x please state year of conversion Gross floor area of dwelling 84 m2 Purpose Built X No of units in block 444 Yes X] No CURRENT OCCUPANCY Above commercial If Yes, please state if this would affect the residential nature of the. Has the property ever been occupied? YesXNo property e.g. Noise, Odour. 171 How many adults appear to live in the property? Test Noise, Odur Property Does the property appear to be an HMO/Multi Unit Freehold Block? Yes xNo If Yes, please provide details Tenure: Freehold Test Current Occupancy Flying freeholdYesX If Yes, what %171 Does the property appear to Yes XNo Road Ground be tenanted at present? Renu'r'1717 Charges  1711 CONS TRUCTION Remaining term of Lease (if unknown as per RICS red book) 9 9 0Years Yes X Is the property of standard construction: No Is any part of the property in commercial use? Yes xNo If non-standard construction specify name of system or type: If Yes please state % in commercial use 7171 Concrete fr ame. Is the property being purchased External finish: YesXNo under a shared ownership scheme? Main Walls: Unitised curtain walling facade Year property built 2026 Concrete Main Roof: NEW BUILD or <10 YEARS OLD Garage: Ashok Garage Is the Property New Build or Recently Converted?YesX No Outbuildings: varun Outbuildings If New Build: CompletedX Under Construction x Yes No Are there any alterations or extensions? x Is Final Inspection Required? Yes X No Did the alterations require Building Regs Is there a: Yes x or Planning Consents? No NHBC Cert XBuild Zone X PremierX] Professional Consultant X Age of any alterations or extensions? 2027Years Other X If Other, please provide details Checkmate'/ Castle 10 Is this a Self-build project? Yes XNo Does this transaction involve an element of part exchange? Yes X No X Has a Disclosure of Incentives form been seen? Yes XNo If Yes, please provide details Including total value of incentives & if part exchange No sales incentives are included in the sale and the lenders legal adviser should be. If property is New Build, please provide the name of Developer: Varun Lender's Copy Gatehouse Bank plc is authorised by the Prudential Regulation Authority and regulated by the Financial Conduct Authority and the Prudential Regulation Page 1 Authority and is incorporated in England and Wales (registered number 06260053) with its registered office at 14 Grosvenor Street, London, W1K 4PS. 10301097-4853 gatehousebank Application Number: LOCALITY & DEMAND CONDITION OF PROPERTY Is location: Urbanx SuburbanX Rural X Is there any evidence of past or ongoing structural. movement to the property? Yes x AverageX Poor X No Market Appeal:Goodx If Yes, is this historic or non progressive? Yesx No Are surrounding properties: If No, please provide details Residential Owner x Commercial X Let Dana adding there is evidence of ongoing structural movement non progressive Are property prices in the area: Have any structural modifications been effected to. RisingX Static x Falling the original building of which we as lenders should. Is demand for this type of property: be aware? Yes x Nc RisingX x Falling Static x If Yes, please provide details Is the property likely to be affected by Test This Condition Of Property Yes X compulsory purchase or clearance? No If Yes, please provide details If internal or external communal areas exist have they XNo X been maintained to a satisfactory standard. Yes Details provided by Dana as a test Is there any evidence of or is the property prone to: Are there any vacant or boarded up FloodingSubsidenceX LandslipX Heave X Yes XNo properties in close proximity? Please provide details:e If Yes, please provide details Ashok Said Please provide Details of 1717 Ashok Provded list of properties Are the plot boundaries well defined and the total Yes XNo below 0.4 hectares? (1 acre) YesxNo Is there a possibility of occupancy restriction? If Yes, please provide details Are there any trees within influencing distance Yes XNo Of the property? Test Ashok. If Yes, please provide details Condition property Is the property close to any high voltage Yes XNo electrical supply equipment? If Yes, please provide details Is the property built on a steeply sloping site? Yes x No Ashok Test this Section If Yes, please provide details SERVICES Property build. Water: MainsX Private X Unknown x REPORTS Gas Yes ElectricityYes Ye's Are any of the following reports required due to major concerns? Central Heating Timber/Damp X Mining x x If Yes, please state the type of central heating Electrical x Electric Drains Arboricultural Mains drainage X x Wall Ties x x Septic tank/Cesspit/Treatment PlantX Mundic Roof X Sulfate (Red ash)x Unknown Metalliferous Other + Solar panels No Shared accessYe sRoad Adopted Yes If Other, please provide details Yes X No Any easements or rights of way Please Provide Reposrts If Yes, please provide details Shared pedestrian access ESSENTIAL REPAIRS Are there any essential repairs required? Yes XNo If house split in to flats, are services separate for each unit? If Yes, please provide details YesX No N/A Ashok Test This Essential Repairs. If No, please provide details Dana adding info about house splitting into flats but no services separate ENERGY EFFICIENCY EPC Rating: A x C D E Exempt None G Yes XNo Is re-inspection required? EPC Score 91 Lender's Copy Gatehouse Bank plc is authorised by the Prudential Regulation Authority and regulated by the Financial Conduct Authority and the Prudential Regulation Page 2 Authority and is incorporated in England and Wales (registered number 06260053) with its registered office at 14 Grosvenor Street, London, W1K 4PS.. 10301097-4853 gatehousebonk Application Number: RENTAL INFORMATION VALUATION FOR FINANCE PURPOSES Valuation to be provided on a comparative basis only. Is there rental demand for a property of this type. in the locality? Yes XNo Is the property suitable security for finance purposes?YesXNo If No, please provide details If No, please provide details Ashok Test this Rental Information Dana says the property is not suitable Monthly market rent sustainable assuming Market Value in present condition 01717 1800 Iet on a 6/12 month AST basis, with the Market Value after essential repairs/completion 347018 property in its present condition? Monthly market rent sustainable assuming Purchase Price/ Borrowers Estimated Value 347018 let on a 6/12 month AST basis, with the. 17171 property in an improved condition and Building Insurance Reinstatement Cost 220000 after any essential repairs? Any other matters which may have an impact Is there anything in the valuer's opinion likely on the ongoing demand for residential letting Yes XNo to cause a loading to the building insurance YesXNo premium? relating to this security? If Yes, please provide details If Yes, please provide details Test The Valuation Finanace Purpose. Dana says there are matters that can impact demand Is the demand for this property only Yes XNo on an investor to investor basis? If Yes, please provide details Dana says this property is only on an investir basis. GENERAL REMARKS : Any other information which in your opinion Gatehouse Bank plc should note: The property is in an area of past mining activity. planningbreachThe valuation assumes that the houseboat pur poses. There was no Ioft access. This is a new build property without an EPc. Our valuation is provided on the assumption that the property will have an EPc of E or better upon completion. Confirmation should be provided that the combustiblecladding system / bal conies fully complies with Building (Amendment) Regul ati ons Sl 2018/1230 prior to Iendi ng. If this is not the case the HS2 situation must be referred to the valuer as our val uation may be affected. IMPORTANT NOTICE TO THE APPLICANT: The Valuer has made this Report without any liability to you. Gatehouse Bank plc, its Agents and the Valuer are not responsible to you for the accuracy of opinions in this Report that relate to the value or the condition of the property. 2. No responsibility to any third party is accepted by Gatehouse Bank plc or the valuer in relation to this report. Lender's Copy Gatehouse Bank plc is authorised by the Prudential Regulation Authority and regulated by the Financial Conduct Authority and the Prudential Regulation Page 3 Authority and is incorporated in England and Wales (registered number 06260053) with its registered office at 14 Grosvenor Street, London, W1K 4PS. 10301097-4853 gatehousebank Application Number: VALUERS DECLARATION 1. I certify that the property offered as security has been inspected by me and that the valuation is a fair indication of the current value and condition for mortgage purposes. I certify that I do not have a direct or indirect interest in the sale of the property and that I have complied with Gatehouse Bank plc Guidelines with my recommendation. This firm holds adequate indemnity insurance.. 2. I further understand that Gatehouse Bank plc may raise finance on the security of the mortgage and I am aware that this valuation will.. accordingly be relied upon by Gatehouse Bank plc and its successors in title and persons deriving title through it, including, without prejudice to. the generality of the foregoing, any trustee on behalf of any group of persons or companies interested in the mortgage.. In particular, I acknowledge a duty of care to Gatehouse Bank plc, its successors and assigns and those deriving title through it together with any. 3. mortgage administrator acting on behalf of Gatehouse Bank plc.. Signature of Valuer / Electronic Signature 501569 = 2620 Address of Valuer Val uation Management Centre, Cumbria Hous E Bedf ord Name of Valuer For and on behalf of Connells Survey & Val uati on Ltd Lei ghton Buzzard Telephone (inc. STD code) 01525218647 Postcode LU7 1GN 01525218632 Fax (inc. STD code) Report Date 19/ 121 2024 E-mail ashok.uw@gmail.com MRICS X FRICS X Professional Qualifications of the Valuer AssocRIcs X 0888246 RICS Number * See Conti nuation Page Lender's Copy Gatehouse Bank plc is authorised by the Prudential Regulation Authority and regulated by the Financial Conduct Authority and the Prudential Regulation Page 4 Authority and is incorporated in England and Wales (registered number 06260053) with its registered office at 14 Grosvenor Street, London, W1K 4PS.. BUY TO LET MORTGAGE VALUATION REPORT - Continuation Page gatehousebank Application Number: 1 0 3 0 1 0 9 7 - 4 8 5 3 Applicant(s) Surname(s) & Initials: Mr's Li Ying Goh Date of Inspection: 19/ 121 2024 Property Address Apart ment 804 12 Bankside Boul evard Salford Postcode: M3 7HX Has a Discl osure of Incentives form been seen?. If Yes, please provide details (continued). required to confirmin accordance with the Uk Fi nance Handbook. * End of Report * Lender's Copy Photosheet (1 of 2) Photo of Front Elevation Photo of Rear Elevation Photo of Bathroom. Photosheet (2 of 2) Photo of Kitchen. Photo of Street Scene",
        "createdAt": null,
        "updatedAt": null
    },
    "all_yes_fields_1_report": {
        "applicationId": null,
        "documentId": null,
        "applicationType": "BUY TO LET MORTGAGE",
        "applicationNumber": "102956154750",
        "applicantName": "varun yasa",
        "dateOfInspection": "27/ 11/ 2024",
        "propertyAddress": "Apartment 1005 12 Bankside Salford M3 7HE Semi-Detached HouseTerraced House Detached House XMaisonette",
        "postCode": "M3 7HE",
        "propertyType": {
            "isDetachedHouse": true,
            "isSemiDetachedHouse": true,
            "isTerracedHouse": true,
            "isBungalow": false,
            "isFlat": true,
            "isMaisonette": true,
            "flatMaisonetteFloor": null,
            "numberOfFloorsInBlock": 44,
            "isBuiltOrOwnedByLocalAuthority": true,
            "ownerOccupationPercentage": 77,
            "isFlatMaisonetteConverted": true,
            "conversionYear": 2002,
            "isPurposeBuilt": true,
            "numberOfUnitsInBlock": 444,
            "isAboveCommercial": true,
            "residentialNatureImpact": "property e.g. ,",
            "tenure": "Freehold",
            "isFlyingFreehold": true,
            "flyingFreeholdPercentage": 11,
            "maintenanceCharge": null,
            "roadCharges": null,
            "groundRent": null,
            "remainingLeaseTermYears": 0,
            "isPartCommercialUse": false,
            "commercialUsePercentage": 9,
            "isPurchasedUnderSharedOwnership": false,
            "yearBuilt": 2024
        },
        "accommodation": {
            "hall": 0,
            "livingRooms": 0,
            "kitchen": 0,
            "isLiftPresent": null,
            "utility": 0,
            "bedrooms": 0,
            "bathrooms": 0,
            "separateWc": 0,
            "basement": 0,
            "garage": 0,
            "parking": 0,
            "gardens": true,
            "isPrivate": true,
            "isCommunal": true,
            "numberOfOutbuildings": 0,
            "outbuildingDetails": null,
            "grossFloorAreaOfDwelling": 2002
        },
        "currentOccupency": {
            "isEverOccupied": false,
            "numberOfAdultsInProperty": 0,
            "isHmoOrMultiUnitFreeholdBlock": true,
            "isCurrentlyTenanted": false,
            "hmoOrMultiUnitDetails": null
        },
        "newBuild": {
            "isNewBuildOrRecentlyConverted": true,
            "isCompleted": true,
            "isUnderConstruction": true,
            "isFinalInspectionRequired": false,
            "isNhbcCert": null,
            "isBuildZone": null,
            "isPremier": null,
            "isProfessionalConsultant": null,
            "isOtherCert": null,
            "otherCertDetails": "please",
            "isSelfBuildProject": false,
            "isInvolvesPartExchange": true,
            "isDisclosureOfIncentivesSeen": true,
            "incentivesDetails": "if part exchange",
            "newBuildDeveloperName": "If property is New Build, please provide the name of"
        },
        "construction": {
            "isStandardConstruction": true,
            "nonStandardConstructionType": true,
            "mainWalls": "External finish",
            "mainRoof": "Gl azed cladding",
            "garageConstruction": "Garage",
            "outbuildingsConstruction": "Outbuildings",
            "isHasAlterationsOrExtensions": false,
            "isAlterationsRequireConsents": false,
            "alterationsAge": null
        },
        "localityAndDemand": {
            "isUrban": true,
            "isSuburban": true,
            "isRural": true,
            "isGoodMarketAppeal": true,
            "isAverageMarketAppeal": true,
            "isPoorMarketAppeal": true,
            "isOwnerResidential": false,
            "isResidentialLet": true,
            "isCommercial": true,
            "isPricesRising": true,
            "isPricesStatic": true,
            "isPricesFalling": true,
            "isDemandRising": true,
            "isDemandStatic": true,
            "isDemandFalling": true,
            "isAffectedByCompulsoryPurchase": true,
            "compulsoryPurchaseDetails": null,
            "isVacantOrBoardedPropertiesNearby": true,
            "vacantOrBoardedDetails": null,
            "isOccupancyRestrictionPossible": true,
            "occupancyRestrictionDetails": null,
            "isCloseToHighVoltageEquipment": false,
            "highVoltageEquipmentDetails": null
        },
        "services": {
            "isMainsWater": true,
            "isPrivateWater": true,
            "isUnknownWater": true,
            "isGasSupply": false,
            "isElectricitySupply": true,
            "isCentralHeating": false,
            "centralHeatingType": null,
            "isMainDrainage": false,
            "isSepticTankPlant": true,
            "isUnknownDrainage": false,
            "isSolarPanels": true,
            "isSharedAccess": false,
            "isRoadAdopted": false,
            "isHasEasementsOrRightsOfWay": true,
            "easementsOrRightsDetails": null,
            "servicesSeparateForFlats": "",
            "servicesSeparateDetails": ""
        },
        "conditionsOfProperty": {
            "isStructuralMovement": null,
            "isStructuralMovementHistoricOrNonProgressive": null,
            "structuralMovementDetails": null,
            "isStructuralModifications": false,
            "structuralModificationsDetails": null,
            "communalAreasMaintained": null,
            "propertyProneTo": {
                "flooding": true,
                "subsidence": true,
                "heave": true,
                "landslip": true,
                "details": "please provide"
            },
            "isPlotBoundariesDefinedUnderPointFourHectares": false,
            "isTreesWithinInfluencingDistance": true,
            "treesInfluenceDetails": null,
            "isBuiltOnSteepSlope": null,
            "steepSlopeDetails": null
        },
        "reports": {
            "isTimberDamp": true,
            "isMining": true,
            "isElectrical": true,
            "isDrains": true,
            "isStructuralEngineers": true,
            "isArboricultural": true,
            "isMundic": true,
            "isWallTies": true,
            "isRoof": true,
            "isMetalliferous": true,
            "isSulfateRedAsh": null,
            "isOtherReport": null,
            "otherReportDetails": null
        },
        "energyEfficiency": {
            "epcRating": "Exempt",
            "epcScore": 50
        },
        "essentialRepairs": {
            "isEssentialRepairsRequired": null,
            "essentialRepairsDetails": null,
            "isReinspectionRequired": null
        },
        "rentalInformation": {
            "isRentalDemandInLocality": false,
            "rentalDemandDetails": null,
            "monthlyMarketRentPresentCondition": null,
            "monthlyMarketRentImprovedCondition": null,
            "isOtherLettingDemandFactors": null,
            "otherLettingDemandDetails": null,
            "investorOnlyDemand": null,
            "investorOnlyDemandDetails": null
        },
        "valuationForFinancePurpose": {
            "valuationComparativeOnly": null,
            "isSuitableForFinance": true,
            "financeSuitabilityDetails": "",
            "marketValuePresentCondition": null,
            "marketValueAfterRepairs": null,
            "purchasePriceOrBorrowerEstimate": 239120.0,
            "buildingInsuranceReinstatementCost": null,
            "isInsurancePremiumLoadingRisk": null,
            "insurancePremiumLoadingDetails": null
        },
        "valuationForFinancePurposeHPP": {
            "valuationComparativeOnly": null,
            "isSuitableForFinance": true,
            "financeSuitabilityDetails": "",
            "marketValuePresentCondition": null,
            "marketValueAfterRepairs": null,
            "purchasePriceOrBorrowerEstimate": 239120.0,
            "buildingInsuranceReinstatementCost": null,
            "isInsurancePremiumLoadingRisk": null,
            "insurancePremiumLoadingDetails": null
        },
        "generalRemarks": "shared pedestrian access. Legal advisors to confirm pur poses There was no Ioft access This is a new build property without an Epc. Our val uation is provided on the assumption that the property will have an EPc of E or better upon completion Confirmation should be provided that the cladding system/ bal conies fully complies with Building",
        "valuersDeclaration": {
            "valuerSignature": null,
            "valuerName": "D Sullivan",
            "onBehalfOf": "D Sullivan",
            "telephone": 1525218647,
            "fax": null,
            "email": "inc. STD code",
            "valuerQualifications": {
                "mrics": false,
                "frics": false,
                "assocRics": true
            },
            "ricsNumber": 6777456,
            "valuerAddress": "Val uation Management Centre, Cumbria Hous D Sullivan Connells Survey & Val uation Ltd Lei ghton Buzzard LU7 1GN Report Date 27/ 11/ 2024",
            "valuerPostcode": "M3 7HE",
            "reportDate": "27/ 11/ 2024"
        },
        "extractedText": "BUY TO LET MORTGAGE VALUATION REPORT gatehousebonk Applicant(s) Surname(s) & Initials: Application Number: 1 0 2 9 5 615 - 4 75 0 varun yasa Date of Inspection: 27/ 11/ 2024 Property Address: Apartment 1005 12 Bankside Salford Postcode: M3 7HE PROPERTY TYPE ACCOMMODATION - State Number Detached HouseX Semi-Detached HouseXTerraced HouseX 0 Living Rooms 0 0 Yes Hall Kitchen 0 0Separate wc X]FIat XMaisonette Bungalow x Utility Bedrooms 0 Bathrooms No. of floors in block 44 Basement 0 0Parking 0 Garage Property built or owned by the Local Authority? YesXNo No Private Gardens If Yes x Communal X If Yes, what is the approximate % of owner occupation7721 Number of outbuildings 0 Is flat / maisonette: (please provide details) If Converted, 2002 Converted x test details please state year of conversion Gross floor area of dwelling 58 m2 Purpose Built X No of units in block 444 Yes [X] CURRENT OCCUPANCY Above commercial No If Yes, please state if this would affect the residential nature of the. Has the property ever been occupied? Yes XNo property e.g. Noise, Odour How many adults appear to live in the property? 0 Test Noise Does the property appear to be an HMO/Multi Unit Freehold Block? Yes XNo If Yes, please provide details Tenure: FreeholdX Leasehold x Current details Flying freeholdYesX No If Yes, what %1117 Does the property appear to Ground Yes XNo Road be tenanted at present? Charges  0 Rent  0 CONSTRUCTION Remaining term of Lease (if unknown as per RICS red book) 9 9 0Years Yes X Is the property of standard construction: No Is any part of the property in commercial use? Yes XNo If non-standard construction specify name of system or type: If Yes please state % in commercial use 11 Concrete frame with cladding Is the property being purchased External finish: Yes XNo under a shared ownership scheme? Gl azed cladding Main Walls: Year property built 2024 Not visible Main Roof: NEW BUILD or < 10 YEARS OLD Garage: test garage Is the Property New Build or Recently Converted?YesX No Outbuildings: test outbuildings Under Construction If New Build: Completed Yes X Are there any alterations or extensions? No Is Final Inspection Required? Yes XNo Did the alterations require Building Regs Is there a: Yes X No or Planning Consents? Age of any alterations or extensions? 117 Years Other X If Other, please provide details Checkmate'/ Castle 10 Is this a Self-build project? Yes XNo Does this transaction involve an element of part exchange? Yes X] No Has a Disclosure of Incentives form been seen? YesX No If Yes, please provide details Including total value of incentives & if part exchange No sales incentives are included in the sale and the lenders legal adviser should be If property is New Build, please provide the name of Developer:. Renaker Lender's Copy Gatehouse Bank plc is authorised by the Prudential Regulation Authority and regulated by the Financial Conduct Authority and the Prudential Regulation Page 1 Authority and is incorporated in England and Wales (registered number 06260053) with its registered office at 14 Grosvenor Street, London, W1K 4PS. 10295615-4750 gatehousebank Application Number: LOCALITY & DEMAND CONDITION OF PROPERTY UrbanX Is location: SuburbanX Rural x Is there any evidence of past or ongoing structural movement to the property? Yes X No Market Appeal: GoodX Averagex Poor x If Yes, is this historic or non progressive? Yes Are surrounding properties: If No, please provide details Residential Owner X Commercial x Let Details Are property prices in the area: x Have any structural modifications been effected to RisingX Static Falling x the original building of which we as lenders should. Is demand for this type of property: be aware? YesX RisingX Static x Falling X If Yes, please provide details Is the property likely to be affected by your text Yes X compulsory purchase or clearance? No If Yes, please provide details If internal or external communal areas exist have they been maintained to a satisfactory standard XNo Test Case Yes Is there any evidence of or is the property prone to: Are there any vacant or boarded up Flooding X SubsidenceX Heave X LandslipX properties in close proximity? YesXNo Please provide details:e If Yes, please provide details your text Test case Are the plot boundaries well defined and the total. Yes XNo below 0.4 hectares? (1 acre) [X No Is there a possibility of occupancy restriction?. Yes If Yes, please provide details Are there any trees within influencing distance Yes XNo Of the property? Test case If Yes, please provide details Is the property close to any high voltage your text Yes [X]No electrical supply equipment? If Yes, please provide details Yes XNo Is the property built on a steeply sloping site? Test case our text If Yes, please provide details SERVICES your text MainsX Private Water: Unknown X REPORTS ElectricityY e s Gas No Central Heating Yes Timber/DampX Mining x Electrical x If Yes, please state the type of central heating Electric x Structural Engineers X Arboricultural x Drains Mains drainage X Mundic x Wall Ties x x Septic tank/Cesspit/Treatment PlantX Roof X Sulfate (Red ash)X x Unknown MetalliferousX Other + Solar panels No Shared accessYe s Road Adopted Yes If Other, please provide details Any easements or rights of way Yes NoX Test reports If Yes, please provide details Shared pedestrian access ESSENTIAL REPAIRS Are there any essential repairs required? Yes XNo If house split in to flats, are services separate for each unit?. If Yes, please provide details YesX No N/A YES If No, please provide details your text ENERGY EFFICIENCY EPC Rating: A B c D E x Exempt None F Yes XNo Is re-inspection required? EPC Score 50 Lender's Copy Gatehouse Bank plc is authorised by the Prudential Regulation Authority and regulated by the Financial Conduct Authority and the Prudential Regulation Page 2 Authority and is incorporated in England and Wales (registered number 06260053) with its registered office at 14 Grosvenor Street, London, W1K 4PS. 10295615-4750 gatehousebonk Application Number: RENTAL INFORMATION VALUATION FOR FINANCE PURPOSES Valuation to be provided on a comparative basis only Is there rental demand for a property of this type in the locality? YesXNo Is the property suitable security for finance purposes?YesXNo If No, please provide details If No, please provide details Test details section Test details section Monthly market rent sustainable assuming Market Value in present condition 0 0 let on a 6/12 month AST basis, with the Market Value after essential repairs/completion property in its present condition? 239120 Monthly market rent sustainable assuming Purchase Price/ Borrowers Estimated Value 239120 let on a 6/12 month AST basis, with the 1350 property in an improved condition and Building Insurance Reinstatement Cost 150000 after any essential repairs? Any other matters which may have an impact Is there anything in the valuer's opinion likely on the ongoing demand for residential letting YesXNo to cause a loading to the building insurance Yes XNo premium? relating to this security? If Yes, please provide details If Yes, please provide details Test details section Test details section Is the demand for this property only on an investor to investor basis? Yes XNo If Yes, please provide details Test details section GENERAL REMARKS: Any other information which in your opinion Gatehouse Bank plc should note: shared pedestrian access. Legal advisors to confirm. pur poses. There was no Ioft access. This is a new build property without an Epc. Our val uation is provided on the assumption that the property will have an EPc of E or better upon completion. Confirmation should be provided that the cladding system/ bal conies fully complies with Building. (Amendment) Regulations'sl 2018/1230 prior to Iending. If this is not the case the situation must be referred to'the val uer as our val uation may be affected. The property is not Iettable in its present condition as it is an incomplete new build. Our 'after. works' rental valuation is provided on the basis of the completed property. IMPORTANT NOTICE TO THE APPLICANT: The Valuer has made this Report without any liability to you. Gatehouse Bank plc, its Agents and the Valuer are not responsible to you for the. accuracy of opinions in this Report that relate to the value or the condition of the property. 2. No responsibility to any third party is accepted by Gatehouse Bank plc or the valuer in relation to this report.. Lender's Copy Gatehouse Bank plc is authorised by the Prudential Regulation Authority and regulated by the Financial Conduct Authority and the Prudential Regulation Page 3 Authority and is incorporated in England and Wales (registered number 06260053) with its registered office at 14 Grosvenor Street, London, W1K 4PS. 10295615-4750 gatehousebank Application Number: VALUERS DECLARATION 1. I certify that the property offered as security has been inspected by me and that the valuation is a fair indication of the current value and condition for mortgage purposes. I certify that I do not have a direct or indirect interest in the sale of the property and that I have complied with Gatehouse Bank plc Guidelines with my recommendation. This firm holds adequate indemnity insurance.. 2. I further understand that Gatehouse Bank plc may raise finance on the security of the mortgage and I am aware that this valuation will.. accordingly be relied upon by Gatehouse Bank plc and its successors in title and persons deriving title through it, including, without prejudice to. the generality of the foregoing, any trustee on behalf of any group of persons or companies interested in the mortgage.. In particular, I acknowledge a duty of care to Gatehouse Bank plc, its successors and assigns and those deriving title through it together with any. 3. mortgage administrator acting on behalf of Gatehouse Bank plc.. Signature of Valuer / Electronic Signature 535036 = 80 6 1 Address of Valuer. Val uation Management Centre, Cumbria Hous D Sullivan Name of Valuer For and on behalf of. Connells Survey & Val uation Ltd. Lei ghton Buzzard. Telephone (inc. STD code) 01525218647 Postcode LU7 1GN Fax (inc. STD code) 01525218632 Report Date 27/ 11/ 2024 E-mail cust omercare@connell s.co. uk. Professional Qualifications of the Valuer. MRICS FRICS AssocRIcsX 6777456 RICS Number * See Conti nuation Page Lender's Copy Gatehouse Bank plc is authorised by the Prudential Regulation Authority and regulated by the Financial Conduct Authority and the Prudential Regulation. Page 4 Authority and is incorporated in England and Wales (registered number 06260053) with its registered office at 14 Grosvenor Street, London, W1K 4PS. gatehousebank Application Number: 1 0 2 9 5 6 15 - 4 75 0 Applicant(s) Surname(s) & Initials:. Mi'ss Shao Jun Koh. Date of Inspection: 27/ 11/ 2024 Property Address Salford Postcode: M3 7HX Has a Discl osure of Incentives form been seen? If Yes, please provide details (continued) required to confirmin accordance with the UK Fi nance Handbook.. * End of Report * Lender's Copy Photosheet (1 of 2) Photo of Front Elevation Photo of Rear Elevation Photo of Bathroom Photosheet (2 of 2). Photo of Kitchen. Photo of Street Scene",
        "createdAt": null,
        "updatedAt": null
    },
    "all_empty_1_report": {
        "applicationId": null,
        "documentId": null,
        "applicationType": "BUY TO LET MORTGAGE",
        "applicationNumber": null,
        "applicantName": null,
        "dateOfInspection": null,
        "propertyAddress": "Terraced House Detached House Semi-Detached House Flat Bungalow Maisonette",
        "postCode": null,
        "propertyType": {
            "isDetachedHouse": false,
            "isSemiDetachedHouse": false,
            "isTerracedHouse": false,
            "isBungalow": false,
            "isFlat": true,
            "isMaisonette": true,
            "flatMaisonetteFloor": null,
            "numberOfFloorsInBlock": null,
            "isBuiltOrOwnedByLocalAuthority": true,
            "ownerOccupationPercentage": null,
            "isFlatMaisonetteConverted": true,
            "conversionYear": null,
            "isPurposeBuilt": false,
            "numberOfUnitsInBlock": null,
            "isAboveCommercial": false,
            "residentialNatureImpact": "property e.g. ,",
            "tenure": "Freehold",
            "isFlyingFreehold": false,
            "flyingFreeholdPercentage": null,
            "maintenanceCharge": null,
            "roadCharges": null,
            "groundRent": null,
            "remainingLeaseTermYears": null,
            "isPartCommercialUse": false,
            "commercialUsePercentage": null,
            "isPurchasedUnderSharedOwnership": false,
            "yearBuilt": null
        },
        "accommodation": {
            "hall": null,
            "livingRooms": null,
            "kitchen": null,
            "isLiftPresent": false,
            "utility": null,
            "bedrooms": null,
            "bathrooms": null,
            "separateWc": null,
            "basement": null,
            "garage": null,
            "parking": null,
            "gardens": false,
            "isPrivate": false,
            "isCommunal": false,
            "numberOfOutbuildings": null,
            "outbuildingDetails": null,
            "grossFloorAreaOfDwelling": null
        },
        "currentOccupency": {
            "isEverOccupied": false,
            "numberOfAdultsInProperty": null,
            "isHmoOrMultiUnitFreeholdBlock": true,
            "isCurrentlyTenanted": false,
            "hmoOrMultiUnitDetails": null
        },
        "newBuild": {
            "isNewBuildOrRecentlyConverted": true,
            "isCompleted": true,
            "isUnderConstruction": true,
            "isFinalInspectionRequired": false,
            "isNhbcCert": false,
            "isBuildZone": null,
            "isPremier": false,
            "isProfessionalConsultant": false,
            "isOtherCert": null,
            "otherCertDetails": "please",
            "isSelfBuildProject": false,
            "isInvolvesPartExchange": true,
            "isDisclosureOfIncentivesSeen": true,
            "incentivesDetails": "if part exchange",
            "newBuildDeveloperName": "If property is New Build, please provide the name of"
        },
        "construction": {
            "isStandardConstruction": false,
            "nonStandardConstructionType": false,
            "mainWalls": "External finish",
            "mainRoof": null,
            "garageConstruction": "Garage",
            "outbuildingsConstruction": "Outbuildings",
            "isHasAlterationsOrExtensions": false,
            "isAlterationsRequireConsents": false,
            "alterationsAge": null
        },
        "localityAndDemand": {
            "isUrban": false,
            "isSuburban": false,
            "isRural": false,
            "isGoodMarketAppeal": false,
            "isAverageMarketAppeal": false,
            "isPoorMarketAppeal": false,
            "isOwnerResidential": false,
            "isResidentialLet": true,
            "isCommercial": false,
            "isPricesRising": false,
            "isPricesStatic": false,
            "isPricesFalling": false,
            "isDemandRising": true,
            "isDemandStatic": true,
            "isDemandFalling": true,
            "isAffectedByCompulsoryPurchase": true,
            "compulsoryPurchaseDetails": null,
            "isVacantOrBoardedPropertiesNearby": true,
            "vacantOrBoardedDetails": null,
            "isOccupancyRestrictionPossible": true,
            "occupancyRestrictionDetails": null,
            "isCloseToHighVoltageEquipment": false,
            "highVoltageEquipmentDetails": null
        },
        "services": {
            "isMainsWater": false,
            "isPrivateWater": false,
            "isUnknownWater": false,
            "isGasSupply": false,
            "isElectricitySupply": false,
            "isCentralHeating": false,
            "centralHeatingType": null,
            "isMainDrainage": false,
            "isSepticTankPlant": false,
            "isUnknownDrainage": false,
            "isSolarPanels": false,
            "isSharedAccess": false,
            "isRoadAdopted": false,
            "isHasEasementsOrRightsOfWay": true,
            "easementsOrRightsDetails": null,
            "servicesSeparateForFlats": "",
            "servicesSeparateDetails": ""
        },
        "conditionsOfProperty": {
            "isStructuralMovement": null,
            "isStructuralMovementHistoricOrNonProgressive": null,
            "structuralMovementDetails": null,
            "isStructuralModifications": false,
            "structuralModificationsDetails": null,
            "communalAreasMaintained": null,
            "propertyProneTo": {
                "flooding": false,
                "subsidence": false,
                "heave": false,
                "landslip": false,
                "details": "please provide"
            },
            "isPlotBoundariesDefinedUnderPointFourHectares": false,
            "isTreesWithinInfluencingDistance": true,
            "treesInfluenceDetails": null,
            "isBuiltOnSteepSlope": null,
            "steepSlopeDetails": null
        },
        "reports": {
            "isTimberDamp": false,
            "isMining": false,
            "isElectrical": true,
            "isDrains": false,
            "isStructuralEngineers": false,
            "isArboricultural": false,
            "isMundic": false,
            "isWallTies": false,
            "isRoof": false,
            "isMetalliferous": false,
            "isSulfateRedAsh": null,
            "isOtherReport": null,
            "otherReportDetails": null
        },
        "energyEfficiency": {
            "epcRating": "Exempt",
            "epcScore": null
        },
        "essentialRepairs": {
            "isEssentialRepairsRequired": null,
            "essentialRepairsDetails": null,
            "isReinspectionRequired": null
        },
        "rentalInformation": {
            "isRentalDemandInLocality": false,
            "rentalDemandDetails": null,
            "monthlyMarketRentPresentCondition": null,
            "monthlyMarketRentImprovedCondition": null,
            "isOtherLettingDemandFactors": null,
            "otherLettingDemandDetails": null,
            "investorOnlyDemand": null,
            "investorOnlyDemandDetails": null
        },
        "valuationForFinancePurpose": {
            "valuationComparativeOnly": null,
            "isSuitableForFinance": false,
            "financeSuitabilityDetails": "",
            "marketValuePresentCondition": null,
            "marketValueAfterRepairs": null,
            "purchasePriceOrBorrowerEstimate": null,
            "buildingInsuranceReinstatementCost": null,
            "isInsurancePremiumLoadingRisk": null,
            "insurancePremiumLoadingDetails": null
        },
        "valuationForFinancePurposeHPP": {
            "valuationComparativeOnly": null,
            "isSuitableForFinance": false,
            "financeSuitabilityDetails": "",
            "marketValuePresentCondition": null,
            "marketValueAfterRepairs": null,
            "purchasePriceOrBorrowerEstimate": null,
            "buildingInsuranceReinstatementCost": null,
            "isInsurancePremiumLoadingRisk": null,
            "insurancePremiumLoadingDetails": null
        },
        "generalRemarks": null,
        "valuersDeclaration": {
            "valuerSignature": null,
            "valuerName": null,
            "onBehalfOf": null,
            "telephone": null,
            "fax": null,
            "email": "inc. STD code",
            "valuerQualifications": {
                "mrics": false,
                "frics": false,
                "assocRics": false
            },
            "ricsNumber": null,
            "valuerAddress": "MRICS FRICS AssocRICS",
            "valuerPostcode": null,
            "reportDate": null
        },
        "extractedText": "BUY TO LET MORTGAGE VALUATION REPORT gatehousebank Applicant(s) Surname(s) & Initials: Application Number: Date of Inspection: Property Address: Postcode: PROPERTY TYPE ACCOMMODATION - State Number Detached House Semi-Detached House Terraced House Hall Living Rooms Kitchen Lift Flat Bathrooms Bungalow Maisonette Utility Bedrooms Separate WC If flat / maisonette on what floor?. Parking No. of floors in block Basement Garage If Yes Private Property built or owned by the Local Authority? Yes No Gardens Communal If Yes, what is the approximate % of owner occupation. Number of outbuildings Is flat / maisonette: (please provide details) If Converted, Converted please state year of conversion Gross floor area of dwelling m2 Purpose Built No of units in block CURRENT OCCUPANCY Above commercial Yes No If Yes, please state if this would affect the residential nature of the Has the property ever been occupied? Yes No property e.g. Noise, Odour How many adults appear to live in the property? Does the property appear to be an HMO/Multi Unit No Freehold Block? Yes If Yes, please provide details Tenure: Freehold Leasehold Flying freehold  Yes No If Yes, what % Does the property appear to Yes Maintenance Ground be tenanted at present?. No Road Charge Charges Rent CONSTRUCTION Remaining term of Lease (if unknown as per RICS red book) Years Is the property of standard construction:. Yes No Is any part of the property in commercial use? Yes No If non-standard construction specify name of system or type: If Yes please state % in commercial use Is the property being purchased. No External finish: Yes under a shared ownership scheme? Main Walls: Year property built Main Roof: NEW BUILD or < 10 YEARS OLD Garage: Is the Property New Build or Recently Converted? Yes No Outbuildings: Under Construction If New Build: Completed Yes Are there any alterations or extensions? No Is Final Inspection Required? Yes No Did the alterations require Building Regs Is there a: Yes No or Planning Consents? NHBC Cert Build Zone Premier Professional Consultant Age of any alterations or extensions? Years Other If Other, please provide details Is this a Self-build project? Yes No Does this transaction involve an element of Yes No part exchange? Has a Disclosure of Incentives form been seen? Yes No If Yes, please provide details Including total value of incentives & if part exchange If property is New Build, please provide the name of Developer: Lender's Copy Gatehouse Bank plc is authorised by the Prudential Regulation Authority and regulated by the Financial Conduct Authority and the Prudential Regulation Page 1 Authority and is incorporated in England and Wales (registered number 06260053) with its registered office at 14 Grosvenor Street, London, W1K 4PS.. 10299700-5015 gatehousebank Application Number: LOCALITY & DEMAND CONDITION OF PROPERTY Is location: Urban Suburban Rural Is there any evidence of past or ongoing structural movement to the property? Yes No Market Appeal: Good Average Poor If Yes, is this historic or non progressive? Yes No Are surrounding properties: If No, please provide details Owner Residential Commercial Residential Let Are property prices in the area: Falling Have any structural modifications been effected to Rising Static the original building of which we as lenders should. Is demand for this type of property: be aware? Yes Jc Rising Falling Static If Yes, please provide details Is the property likely to be affected by Yes compulsory purchase or clearance? No If Yes, please provide details If internal or external communal areas exist have they No Testing been maintained to a satisfactory standard Yes Is there any evidence of or is the property prone to: Are there any vacant or boarded up Flooding Subsidence Heave Landslip properties in close proximity? Yes No Please provide details: If Yes, please provide details Are the plot boundaries well defined and the total. Yes below 0.4 hectares? (1 acre) Is there a possibility of occupancy restriction?. No Yes No Are there any trees within influencing distance If Yes, please provide details of the property? Yes No If Yes, please provide details Is the property close to any high voltage Yes No electrical supply equipment? If Yes, please provide details Is the property built on a steeply sloping site? Yes No If Yes, please provide details SERVICES Water: Mains Private Unknown REPORTS Gas Electricity Are any of the following reports required due to major concerns?. Central Heating Timber/Damp Mining If Yes, please state the type of central heating Electrical Structural Engineers Drains Arboricultural Mains drainage Septic tank/Cesspit/Treatment Plant Mundic Wall Ties Roof Unknown Metalliferous Sulfate (Red ash) Other + Solar panels Shared access Road Adopted If Other, please provide details Any easements or rights of way Yes No If Yes, please provide details ESSENTIAL REPAIRS Are there any essential repairs required? Yes No If house split in to flats, are services separate for each unit?. If Yes, please provide details Yes No N/A If No, please provide details ENERGY EFFICIENCY EPC Rating: A C D E Exempt None c Is re-inspection required? Yes No. EPC Score Lender's Copy Gatehouse Bank plc is authorised by the Prudential Regulation Authority and regulated by the Financial Conduct Authority and the Prudential Regulation Page 2 Authority and is incorporated in England and Wales (registered number 06260053) with its registered office at 14 Grosvenor Street, London, W1K 4PS. 10299700-5015 gatehousebanks Application Number: RENTAL INFORMATION VALUATION FOR FINANCE PURPOSES Valuation to be provided on a comparative basis only Is there rental demand for a property of this type in the locality?. No Yes Is the property suitable security for finance purposes? Yes No If No, please provide details If No, please provide details Monthly market rent sustainable assuming Market Value in present condition. Iet on a 6/12 month AST basis, with the Market Value after essential repairs/completion property in its present condition? Monthly market rent sustainable assuming. Purchase Price/ let on a 6/12 month AST basis, with the Borrowers Estimated Value. property in an improved condition and. Building Insurance Reinstatement Cost after any essential repairs? Is there anything in the valuer's opinion likely to cause a loading to the building insurance on the ongoing demand for residential letting Yes No Yes No premium? relating to this security? If Yes, please provide details If Yes, please provide details. Is the demand for this property only Yes No on an investor to investor basis? If Yes, please provide details GENERAL REMARKS: Any other information which in your opinion Gatehouse Bank plc should note:. IMPORTANT NOTICE TO THE APPLICANT The Valuer has made this Report without any liability to you. Gatehouse Bank plc, its Agents and the Valuer are not responsible to you for the accuracy of opinions in this Report that relate to the value or the condition of the property.. 2. No responsibility to any third party is accepted by Gatehouse Bank plc or the valuer in relation to this report.. Gatehouse Bank plc is authorised by the Prudential Regulation Authority and regulated by the Financial Conduct Authority and the Prudential Regulation. Lender's Copy. Page 3 Authority and is incorporated in England and Wales (registered number 06260053) with its registered office at 14 Grosvenor Street, London, W1K 4PS. gatehousebank Application Number: VALUERS DECLARATION 1 I certify that the property offered as security has been inspected by me and that the valuation is a fair indication of the current value and condition for mortgage purposes. I certify that I do not have a direct or indirect interest in the sale of the property and that I have complied with Gatehouse Bank plc Guidelines with my recommendation. This firm holds adequate indemnity insurance. 2. I further understand that Gatehouse Bank plc may raise finance on the security of the mortgage and I am aware that this valuation will accordingly be relied upon by Gatehouse Bank plc and its successors in title and persons deriving title through it, including, without prejudice to 3. In particular, I acknowledge a duty of care to Gatehouse Bank plc, its successors and assigns and those deriving title through it together with any mortgage administrator acting on behalf of Gatehouse Bank plc.. Signature of Valuer / Electronic Signature. Address of Valuer Name of Valuer For and on behalf of Telephone (inc. STD code) Postcode Fax (inc. STD code) Report Date E-mail Professional Qualifications of the Valuer MRICS FRICS AssocRICS RICS Number Gatehouse Bank plc is authorised by the Prudential Regulation Authority and regulated by the Financial Conduct Authority and the Prudential Regulation Lender's Copy Page 4 Authority and is incorporated in England and Wales (registered number 06260053) with its registered office at 14 Grosvenor Street, London, W1K 4PS. Photosheet (1 of 2) Photo of Front Elevation Photo of Rear Elevation Photo of Bathroom Photosheet (2 of 2) Photo of Kitchen. Photo of Street Scene",
        "createdAt": null,
        "updatedAt": null
    }
}